{"schema_version":"foigent.integration-campaign-authorization-signature.v1","purpose":"integration_campaign_authorization","domain":"foigent.integration-campaign-authorization.v1","signing_key_ref":"integration-authorization-fixture-01","signer_public_key_id":"ed25519:sha256:7bb96b8b64efbaade610d2f567d51fde1828209b51bd796e869eaad3d7960d38","trust_set_sha256":"sha256:190e909cc5eb783a7a2c422039288f032684eaea6f4abb35842e73240b98fbe1","authorization_sha256":"sha256:132a5066d719c6093f4566fff13e5ab4f4c837a57c30beb64a655ccf745cb921","algorithm":"ed25519","value":"MA0XZZIuVTaKPEepUfEp6poMCLwJJX7JFTGdgEPbl9Qb5J13fB/SqsAz7KUkp9my96vUWJ9t70WNl30Ji3tmCA=="}